subreddit,post_id,created_utc,created_iso,author,title,selftext,score,upvote_ratio,num_comments,permalink,url,over_18,stickied,locked,spoiler,flair
Bitcoin,1mthkk1,1755510561.0,2025-08-18T09:49:21+00:00,Head-Reception6803,Bitcoin or Die: Why the Game is Rigged,,3,0.71,0,https://reddit.com/r/Bitcoin/comments/1mthkk1/bitcoin_or_die_why_the_game_is_rigged/,https://www.youtube.com/watch?v=ULBbLEe6Kik&ab_channel=WisdomofBitcoin,False,False,False,False,
cryptomarkets,1mthgw2,1755510196.0,2025-08-18T09:43:16+00:00,No_Abalone_4148,Do you need any of these service ?,"We’ve been involved in the crypto space for several years, working with different projects as marketers, community builders, and investor magnets. Our experience has allowed us to help projects grow communities, attract investors, and gain real momentum.

Here’s what we specialize in:

1.Crypto coin pumps
2.Telegram & X community growth
3.Reply engagement & raiders
4.KOL management
5.Full-scale crypto marketing


Over time, we’ve helped coins reach new highs and wallet projects gain solid traction. We focus on strategies that not only bring attention but also build long-term engagement.

If you’re building something in the crypto space and want to scale your project, we’d be glad to share our experience and explore how we can work together.",0,0.2,0,https://reddit.com/r/CryptoMarkets/comments/1mthgw2/do_you_need_any_of_these_service/,https://www.reddit.com/r/CryptoMarkets/comments/1mthgw2/do_you_need_any_of_these_service/,False,False,False,False,STRATEGY
ethereum,1mthfsj,1755510090.0,2025-08-18T09:41:30+00:00,Fortknightdad2231,crypto loan while the market is acting weird,"so Ive got 4 ETH sitting around on nехо and been thinking about taking a loan against it. done this a couple times before when the market was shaky, and it kinda worked out, mostly cause I guessed the dip was temporary. Last time after the CPI report in may I moved a bit and it bounced, and once more a little when the Fed hinted at pausing rates, so I think I got a slightly better feel for these swings than usual.  
  
this recent drop doesnt feel permanent, just people freaking out over inflation numbers and the fed talks. When the market recovers next month, could use the loan to move into a few things without selling my ETH and maybe even pick up more before it bounces.  
  
borrowing is not free, interest adds up, but Ive got some backup just in case I need it, so no risk of getting liquidated. honestly rates arent bad and id rather have liquidity than sell and lock in losses, even if its just a short term play. ethereum upgrades could shake things up too, maybe push price up if staking incentives kick in or gas fees drop, who knows.",3,0.71,9,https://reddit.com/r/ethereum/comments/1mthfsj/crypto_loan_while_the_market_is_acting_weird/,https://www.reddit.com/r/ethereum/comments/1mthfsj/crypto_loan_while_the_market_is_acting_weird/,False,False,False,False,
Bitcoin,1mthb7p,1755509630.0,2025-08-18T09:33:50+00:00,927363729,6 months of putting my paycheck into bitcoin?,i’m 18 & i’m thinking of putting every single dollar of my paycheck for the next 6 months into bitcoin. I don’t have a car but I need one ideally $15-20k. Do you think I could hit my goal with this? or am I chasing a dream ,8,0.9,10,https://reddit.com/r/Bitcoin/comments/1mthb7p/6_months_of_putting_my_paycheck_into_bitcoin/,https://www.reddit.com/r/Bitcoin/comments/1mthb7p/6_months_of_putting_my_paycheck_into_bitcoin/,False,False,False,False,
Bitcoin,1mth9z1,1755509495.0,2025-08-18T09:31:35+00:00,EmbarrassedOil8707,Which one would you choose?,,164,0.89,109,https://reddit.com/r/Bitcoin/comments/1mth9z1/which_one_would_you_choose/,https://i.redd.it/hrma61h0zqjf1.png,False,False,False,False,
CryptoCurrency,1mth94h,1755509410.0,2025-08-18T09:30:10+00:00,Illperformance6969,"Bitcoin risks further slide toward $112,000 after surprise market correction",,4,0.57,13,https://reddit.com/r/CryptoCurrency/comments/1mth94h/bitcoin_risks_further_slide_toward_112000_after/,https://cryptoslate.com/bitcoin-risks-further-slide-toward-112000-after-surprise-market-correction/,False,False,False,False,🟢 GENERAL-NEWS
Bitcoin,1mth0zq,1755508593.0,2025-08-18T09:16:33+00:00,mujcek,Cold wallet for iphone,What are best storage btc only,0,0.5,13,https://reddit.com/r/Bitcoin/comments/1mth0zq/cold_wallet_for_iphone/,https://www.reddit.com/r/Bitcoin/comments/1mth0zq/cold_wallet_for_iphone/,False,False,False,False,
Bitcoin,1mtgoqf,1755507347.0,2025-08-18T08:55:47+00:00,Ok_Peak_1449,Bitcoin today,"Analysts: ""BTC at 150k by the end of the year!""

Bitcoin: makes Moonwalk backwards to 115k

Me: ""So... is this the dip or the fall?""

#Bitcoin #Crypto #Volatility
",51,0.82,12,https://reddit.com/r/Bitcoin/comments/1mtgoqf/bitcoin_today/,https://i.redd.it/j7tle49nsqjf1.jpeg,False,False,False,False,
cryptomarkets,1mtggbi,1755506452.0,2025-08-18T08:40:52+00:00,skyline649,10-20K€ in Bitcoin ???,"I’m trying to predict the market a little bit… so I wonder what you guys think about a future investment in bitcoin… Will we see it drop under 100,000 or not anymore… cause if it does I would like to put between 10–20 K in it and just forget about it for some years :) .. ",3,1.0,5,https://reddit.com/r/CryptoMarkets/comments/1mtggbi/1020k_in_bitcoin/,https://www.reddit.com/r/CryptoMarkets/comments/1mtggbi/1020k_in_bitcoin/,False,False,False,False,STRATEGY
Bitcoin,1mtgexd,1755506305.0,2025-08-18T08:38:25+00:00,Haunting_Tax_5991,Why I Still Believe in Bitcoin Despite All the Noise,"Every week there’s some new headline, altcoins pumping, memecoins crashing, regulations tightening, ETFs buying, miners selling. It’s easy to get distracted in the noise.

But whenever I zoom out, I always end up back at the same place: **Bitcoin**. It’s not the fastest chain, not the flashiest tech, and definitely not the trendiest narrative. Yet, it’s the one asset that has consistently proven it can survive every cycle, every attack, every “Bitcoin is dead” article.

What keeps me hooked is how simple it really is. A decentralized, borderless store of value that no one controls. I can move it, hold it, save it, or spend it, without needing anyone’s permission. In times where inflation eats up savings and trust in traditional finance feels shaky, Bitcoin makes more sense than ever.

Of course, the price volatility can be wild. I’ve learned to just zoom out, stack little by little, and not overthink the day-to-day moves. For me, it’s less about quick gains and more about building something for the long run.

Curious to hear from the community, what keeps *you* holding Bitcoin after all these years? Is it the philosophy, the profits, or just pure belief in where it’s headed?",6,0.65,15,https://reddit.com/r/Bitcoin/comments/1mtgexd/why_i_still_believe_in_bitcoin_despite_all_the/,https://www.reddit.com/r/Bitcoin/comments/1mtgexd/why_i_still_believe_in_bitcoin_despite_all_the/,False,False,False,False,
cryptomarkets,1mtgdpm,1755506170.0,2025-08-18T08:36:10+00:00,nemleszekpolcorrect,Only 2 coins to HODL for 10+ years,"Hi.

As above. I would like to buy only 2 coins, transfer them on to Safepal and forget about them for 10 years.

Which coins will still exist and have value, preferably more than the time of buying them? Which ones would be your choice?",5,0.69,34,https://reddit.com/r/CryptoMarkets/comments/1mtgdpm/only_2_coins_to_hodl_for_10_years/,https://www.reddit.com/r/CryptoMarkets/comments/1mtgdpm/only_2_coins_to_hodl_for_10_years/,False,False,False,False,
CryptoCurrency,1mtgbw8,1755505968.0,2025-08-18T08:32:48+00:00,kirtash93,"Sir, We Found Him",,0,0.38,3,https://reddit.com/r/CryptoCurrency/comments/1mtgbw8/sir_we_found_him/,https://i.redd.it/wqw5987ioqjf1.png,False,False,False,False,MEME
ethtrader,1mtg7yj,1755505535.0,2025-08-18T08:25:35+00:00,CymandeTV,Japan to approve yen-backed stablecoins for first time this fall,,13,1.0,9,https://reddit.com/r/ethtrader/comments/1mtg7yj/japan_to_approve_yenbacked_stablecoins_for_first/,https://www.cryptopolitan.com/japan-to-approve-yen-backed-stablecoins/,False,False,False,False,Link
Bitcoin,1mtg79o,1755505461.0,2025-08-18T08:24:21+00:00,Melodic_Ad_4253,Beginner/ first time buyer,"Hello good people,
So I decided to finally start steady buying, in my country we don't have many applications to buy, just Binance.

So the problem is when I search google it says 1BTC= 115,270 USD and when I try to buy from Binance (using card) everything is good untill we reach the payment page, it says 1 BTC= 120,886 USD

Sorry I'm new to this, can someone teach me how to buy on Binance with the real price please.

Thanks ",4,0.84,5,https://reddit.com/r/Bitcoin/comments/1mtg79o/beginner_first_time_buyer/,https://www.reddit.com/r/Bitcoin/comments/1mtg79o/beginner_first_time_buyer/,False,False,False,False,
CryptoCurrency,1mtg2qo,1755504984.0,2025-08-18T08:16:24+00:00,dreamyrhodes,"Got a small inheritance of 50k, wondering about crypto strategy","I already got some coins, BTC and a few ""shitcoin"" shenanigans, worth like 5k alltogether. I stayed away from crypto for awhile but now I wonder how to invest the 50k. Want to put \*some\* (I don't know yet how much) in crypto.

What would be the strategy?

\- Take the dedicated part and put all in at once

\- Just buy in small parts no matter what the prices say

\- Wait for stronger bear signal and buy in small steps on the way down (probably starting now)

\- Wait for bear signal and try to time the dip to buy in (sounds difficult)",2,0.54,41,https://reddit.com/r/CryptoCurrency/comments/1mtg2qo/got_a_small_inheritance_of_50k_wondering_about/,https://www.reddit.com/r/CryptoCurrency/comments/1mtg2qo/got_a_small_inheritance_of_50k_wondering_about/,False,False,False,False,STRATEGY
CryptoCurrency,1mtfuup,1755504142.0,2025-08-18T08:02:22+00:00,Natural_NoChemical,Technical Analysis(TA) or Puppy Analysis(PA)?,"Crypto never disappoints. Just when you think you have seen it all, someone launches a coin and literally uses the price action to sketch out a dog on the chart. Yes, that is right, we have officially entered the era of artistic candlesticks.

I am not sure if this is supposed to be bullish or bearish, but one thing is certain, this market is creative. We have gone from head and shoulders patterns to full Labradors. Who needs Elliott Waves when you can have German Shepherds?

On the funny side, this is peak meme potential. On the serious side, it is also a reminder of how absurd some altcoin projects can get. Teams or whales can manipulate low-liquidity coins so much that they can literally draw on the chart. While it is hilarious, it is also a neon sign saying do not ape into coins just because the chart looks cute.

That being said, if the next pattern I see is a Shiba Inu wagging its tail, I might actually consider it a bullish signal.",3,0.71,2,https://reddit.com/r/CryptoCurrency/comments/1mtfuup/technical_analysista_or_puppy_analysispa/,https://www.reddit.com/r/CryptoCurrency/comments/1mtfuup/technical_analysista_or_puppy_analysispa/,False,False,False,False,DISCUSSION
CryptoCurrency,1mtfrz9,1755503853.0,2025-08-18T07:57:33+00:00,Natural_NoChemical,"Japan's FSA to Approve First Yen-Denominated Stablecoin, JPYC, This Autumn – News Bytes Bitcoin News",,1,0.67,0,https://reddit.com/r/CryptoCurrency/comments/1mtfrz9/japans_fsa_to_approve_first_yendenominated/,https://news.bitcoin.com/japans-fsa-to-approve-first-yen-denominated-stablecoin-jpyc-this-autumn/,False,False,False,False,GENERAL-NEWS
CryptoCurrency,1mtfrup,1755503840.0,2025-08-18T07:57:20+00:00,DryMyBottom,Metaplanet expands Bitcoin holdings with 775 BTC purchase,,0,0.5,1,https://reddit.com/r/CryptoCurrency/comments/1mtfrup/metaplanet_expands_bitcoin_holdings_with_775_btc/,https://crypto.news/metaplanet-expands-bitcoin-holdings-with-775-btc-purchase/,False,False,False,False,GENERAL-NEWS
CryptoCurrency,1mtfrp4,1755503821.0,2025-08-18T07:57:01+00:00,Natural_NoChemical,BTC To Explode Again ? Brandt Thinks So,,0,0.5,3,https://reddit.com/r/CryptoCurrency/comments/1mtfrp4/btc_to_explode_again_brandt_thinks_so/,https://www.cointribune.com/en/bitcoin-to-280k-brandt-and-halls-cycle-model-stuns-market/,False,False,False,False,GENERAL-NEWS
CryptoCurrency,1mtf3i0,1755501279.0,2025-08-18T07:14:39+00:00,Savi321,Taxman sets out to draw up a crypto code,,0,0.25,0,https://reddit.com/r/CryptoCurrency/comments/1mtf3i0/taxman_sets_out_to_draw_up_a_crypto_code/,https://m.economictimes.com/news/economy/policy/does-india-needs-new-law-on-virtual-digital-assets-cbdt-asks-cryptocurrency-players/articleshow/123350522.cms,False,False,False,False,GENERAL-NEWS
cryptomarkets,1mtf2u4,1755501210.0,2025-08-18T07:13:30+00:00,LongAd1474,"Why the World Economic Forum Highlights XRP, HBAR, and XLM",,3,0.81,0,https://reddit.com/r/CryptoMarkets/comments/1mtf2u4/why_the_world_economic_forum_highlights_xrp_hbar/,https://allincrypto.com/why-world-economic-forum-highlights-xrp-hbar-and-xlm/,False,False,False,False,NEWS
cryptomarkets,1mtf2rk,1755501203.0,2025-08-18T07:13:23+00:00,Over-Roll,Best app to leverage crypto,"I’m still new at this, I’ve been doing some crypto trading lately with leverage on some demo account with Meta trader and now I feel like I want to try dipping my feet in the real thing (of course, with very small amounts of money first, just an initial test to get used to it). 

What do people mostly use for buying and selling crypto with leverage?  ",1,1.0,6,https://reddit.com/r/CryptoMarkets/comments/1mtf2rk/best_app_to_leverage_crypto/,https://www.reddit.com/r/CryptoMarkets/comments/1mtf2rk/best_app_to_leverage_crypto/,False,False,False,False,Tool
CryptoCurrency,1mtf1lt,1755501076.0,2025-08-18T07:11:16+00:00,ChemicalAnybody6229,Can China Stimulus Begin New Altcoin Rally?,,0,0.33,3,https://reddit.com/r/CryptoCurrency/comments/1mtf1lt/can_china_stimulus_begin_new_altcoin_rally/,https://beincrypto.com/china-stimulus-could-spark-altcoin-rally-as-economic-data-weakens/,False,False,False,False,GENERAL-NEWS
Bitcoin,1mtf0pl,1755500986.0,2025-08-18T07:09:46+00:00,rBitcoinMod,"Mentor Monday, August 18, 2025: Ask all your bitcoin questions!","Ask (and answer!) away! Here are the general rules:

* If you'd like to learn something, ask.
* If you'd like to share knowledge, answer.
* Any question about Bitcoin is fair game.

And don't forget to check out /r/BitcoinBeginners

You can sort by new to see the latest questions that may not be answered yet.",4,1.0,8,https://reddit.com/r/Bitcoin/comments/1mtf0pl/mentor_monday_august_18_2025_ask_all_your_bitcoin/,https://www.reddit.com/r/Bitcoin/comments/1mtf0pl/mentor_monday_august_18_2025_ask_all_your_bitcoin/,False,True,False,False,
Bitcoin,1mtexsx,1755500671.0,2025-08-18T07:04:31+00:00,vision367,"Cat should look carefully, Bitcoin is up 😃🚀🚀",,71,0.98,6,https://reddit.com/r/Bitcoin/comments/1mtexsx/cat_should_look_carefully_bitcoin_is_up/,https://i.redd.it/o3oe1zjs8qjf1.jpeg,False,False,False,False,
Bitcoin,1mtemah,1755499509.0,2025-08-18T06:45:09+00:00,Rroytje,Beginner buyer,"Hi all!

I am a first time Bitcoin buyer and with this post I am looking for tips and tricks.
I dont have alot of wealth so I would like to deposit $5 into Bitcoin everyday.

- Which platform is the easiest to use?
- And do i have to setup other things before I am getting started?

I appreciate your time for reading my post and appreciate your help.",4,1.0,8,https://reddit.com/r/Bitcoin/comments/1mtemah/beginner_buyer/,https://www.reddit.com/r/Bitcoin/comments/1mtemah/beginner_buyer/,False,False,False,False,
ethtrader,1mtehsw,1755499055.0,2025-08-18T06:37:35+00:00,SigiNwanne,South Korea’s Jeju City targets crypto holdings of alleged tax dodgers,,3,1.0,14,https://reddit.com/r/ethtrader/comments/1mtehsw/south_koreas_jeju_city_targets_crypto_holdings_of/,https://cointelegraph.com/news/south-korea-jeju-city-targets-crypto-holdings-alleged-tax-dodgers,False,False,False,False,Link
Bitcoin,1mteep0,1755498740.0,2025-08-18T06:32:20+00:00,d-resistance,What would you do for bitcoin?,,27,0.91,11,https://reddit.com/r/Bitcoin/comments/1mteep0/what_would_you_do_for_bitcoin/,https://www.reddit.com/gallery/1mteep0,False,False,False,False,
CryptoCurrency,1mte6w3,1755497958.0,2025-08-18T06:19:18+00:00,DryMyBottom,Why Circle and Stripe (And Many Others) Are Launching Their Own Blockchains,,4,0.75,0,https://reddit.com/r/CryptoCurrency/comments/1mte6w3/why_circle_and_stripe_and_many_others_are/,https://www.coindesk.com/news-analysis/2025/08/17/why-circle-and-stripe-and-many-others-are-launching-their-own-blockchains,False,False,False,False,🟢 GENERAL-NEWS
ethtrader,1mte4sj,1755497749.0,2025-08-18T06:15:49+00:00,Odd-Radio-8500,PEPE tops the charts for Ethereum tokens in weekly trading volume.,,16,0.87,30,https://reddit.com/r/ethtrader/comments/1mte4sj/pepe_tops_the_charts_for_ethereum_tokens_in/,https://i.redd.it/lyt14nl30qjf1.jpeg,False,False,False,False,Image/Video
Bitcoin,1mte0hp,1755497321.0,2025-08-18T06:08:41+00:00,Cryptic_Phantom_,Time to buy the dip,,309,0.94,82,https://reddit.com/r/Bitcoin/comments/1mte0hp/time_to_buy_the_dip/,https://i.redd.it/5s253w2uypjf1.jpeg,False,False,False,False,
Bitcoin,1mte0d3,1755497310.0,2025-08-18T06:08:30+00:00,rBitcoinMod,"Daily Discussion, August 18, 2025","Please utilize this sticky thread for all general **Bitcoin** discussions! If you see posts on the front page or /r/Bitcoin/new which are better suited for this daily discussion thread, please help out by directing the OP to this thread instead. Thank you!

If you don't get an answer to your question, you can try phrasing it differently or commenting again tomorrow.

Please check the [previous discussion thread](https://www.reddit.com/r/Bitcoin/comments/1msj6ca/daily_discussion_august_17_2025/) for unanswered questions.",14,0.95,21,https://reddit.com/r/Bitcoin/comments/1mte0d3/daily_discussion_august_18_2025/,https://www.reddit.com/r/Bitcoin/comments/1mte0d3/daily_discussion_august_18_2025/,False,True,False,False,
cryptomarkets,1mtdkcp,1755495744.0,2025-08-18T05:42:24+00:00,sylsau,The iPhone's Architects Are Fixing Bitcoin's Biggest Problem: Inside Proto's $100 Million Bet to Remake an Industry.,,4,0.83,1,https://reddit.com/r/CryptoMarkets/comments/1mtdkcp/the_iphones_architects_are_fixing_bitcoins/,https://inbitcoinwetrust.substack.com/p/the-iphones-architects-are-fixing,False,False,False,False,DISCUSSION
Bitcoin,1mtdi1u,1755495505.0,2025-08-18T05:38:25+00:00,BeefSupreme2,How to give to the poor with Bitcoin?,"The stoplight bums, how to give with Bitcoin? They need a phone or something that communicates with the internet to spend?

Bitcoin is God's money, so how to give to the poor/needy as God commands? Would bums even have value for Bitcoin, or is it like giving pearls to swine?",0,0.38,8,https://reddit.com/r/Bitcoin/comments/1mtdi1u/how_to_give_to_the_poor_with_bitcoin/,https://www.reddit.com/r/Bitcoin/comments/1mtdi1u/how_to_give_to_the_poor_with_bitcoin/,False,False,False,False,
ethtrader,1mtdgxk,1755495393.0,2025-08-18T05:36:33+00:00,Extension-Survey3014,Thailand plans to launch crypto payment sandbox for tourists,,16,1.0,14,https://reddit.com/r/ethtrader/comments/1mtdgxk/thailand_plans_to_launch_crypto_payment_sandbox/,https://cointelegraph.com/news/thailand-plans-launch-crypto-payment-tourists,False,False,False,False,Link
Bitcoin,1mtd022,1755493767.0,2025-08-18T05:09:27+00:00,Admirable_Ice3247,A quote from Satoshi,Bitcoin is God's coin and he will flood the lands of all scammers and speculators.Restore it to proper balance of freedom lovers.,0,0.4,4,https://reddit.com/r/Bitcoin/comments/1mtd022/a_quote_from_satoshi/,https://www.reddit.com/r/Bitcoin/comments/1mtd022/a_quote_from_satoshi/,False,False,False,False,
CryptoCurrency,1mtcxte,1755493557.0,2025-08-18T05:05:57+00:00,Im-already-here,"Asia Morning Briefing: Crypto's Rising Leverage Trades Show Signs of Stress, Galaxy Digital Says",,8,0.83,1,https://reddit.com/r/CryptoCurrency/comments/1mtcxte/asia_morning_briefing_cryptos_rising_leverage/,https://www.coindesk.com/markets/2025/08/18/asia-morning-briefing-crypto-s-rising-leverage-trades-show-signs-of-stress-galaxy-digital-says,False,False,False,False,🟢 GENERAL-NEWS
CryptoCurrency,1mtcxd0,1755493512.0,2025-08-18T05:05:12+00:00,Im-already-here,"Altseason’s next step depends on China stimulus, investors’ response to recession fears",,8,0.63,12,https://reddit.com/r/CryptoCurrency/comments/1mtcxd0/altseasons_next_step_depends_on_china_stimulus/,https://cointelegraph.com/news/altseason-s-next-step-depends-on-china-stimulus-investors-response-to-recession-fears,False,False,False,False,🔴 UNRELIABLE SOURCE
ethereum,1mtcv5o,1755493311.0,2025-08-18T05:01:51+00:00,EthereumDailyThread,"Daily General Discussion August 18, 2025","**Welcome to the Daily General Discussion on** r/ethereum

[https://imgur.com/3y7vezP](https://imgur.com/3y7vezP)

Bookmarking this link will always bring you to the current daily:  [https://old.reddit.com/r/ethereum/about/sticky/?num=2](https://old.reddit.com/r/ethereum/about/sticky/?num=2)

Please use this thread to discuss Ethereum topics, news, events, and even *price*!

Price discussion posted elsewhere in the subreddit will **continue to be removed.**

As always, be constructive. - [Subreddit Rules](https://www.reddit.com/r/ethereum/about/rules/)

Want to stake?  Learn more at r/ethstaker

**Community Links**

* [Ethereum Jobs](https://ethereum.org/en/community/get-involved/#ethereum-jobs), [Twitter](https://x.com/ethereum)
* [EVMavericks YouTube](https://www.youtube.com/@evmavericks),  [Discord](https://discord.gg/evmavericks), [Doots Podcast](https://evmavericks.libsyn.com/)
* [Doots Website](https://dailydoots.com/), Old Reddit [Doots Extension](https://github.com/etheralpha/ethfinance-extension) by u/hanniabu

Calendar:  [https://dailydoots.com/events/](https://dailydoots.com/events/)",76,0.99,62,https://reddit.com/r/ethereum/comments/1mtcv5o/daily_general_discussion_august_18_2025/,https://www.reddit.com/r/ethereum/comments/1mtcv5o/daily_general_discussion_august_18_2025/,False,True,False,False,Discussion
CryptoCurrency,1mtcoz4,1755492736.0,2025-08-18T04:52:16+00:00,Alive-Opportunity708,Volatility Vanishes Across Markets as Traders Brace for Powell's Jackson Hole Speech,,1,0.55,3,https://reddit.com/r/CryptoCurrency/comments/1mtcoz4/volatility_vanishes_across_markets_as_traders/,https://www.coindesk.com/markets/2025/08/17/volatility-vanishes-across-markets-as-traders-brace-for-powell-s-jackson-hole-speech,False,False,False,False,🟢 GENERAL-NEWS
CryptoCurrency,1mtcn5p,1755492554.0,2025-08-18T04:49:14+00:00,Alive-Opportunity708,Solana hits 100K TPS milestone with stress test transaction spike,,0,0.5,3,https://reddit.com/r/CryptoCurrency/comments/1mtcn5p/solana_hits_100k_tps_milestone_with_stress_test/,https://cointelegraph.com/news/solana-taps-100k-tps-stress-test-dev,False,False,False,False,🔴 UNRELIABLE SOURCE
Bitcoin,1mtcir4,1755492146.0,2025-08-18T04:42:26+00:00,nem3sis_AUT,🔥 Bitcoin is on sale 🔥,"Just bought the dip.

Have a great week ladies and gents!

Stay humble, keep stacking.",96,0.94,18,https://reddit.com/r/Bitcoin/comments/1mtcir4/bitcoin_is_on_sale/,https://www.reddit.com/r/Bitcoin/comments/1mtcir4/bitcoin_is_on_sale/,False,False,False,False,
