subreddit,post_id,created_utc,created_iso,author,title,selftext,score,upvote_ratio,num_comments,permalink,url,over_18,stickied,locked,spoiler,flair
Bitcoin,1msy1ay,1755454108.0,2025-08-17T18:08:28+00:00,fivehints,Not paying down debt instead adding BTC.,"For the last 6 years I have paid the minimum on all my debit. My primary mortgage 3%, I have never paid a penny over the monthly payments. Car loan 1% never ever pay extra. Margin in brokerage. Just enough to offset interest. 

This entire time the money I would of used to pay down low interest debt I have been plowing into BTC for years now, no matter the price. It was a rough couple years to start. Now I have officially tripled my fiat value vs. my debt in just 6 years. Literally started with nothing. If I would of paid off my debt instead. I would of had no BTC and still owed probably. 

If you can mentally handle the debit I highly recommend just buying BTC instead. First off no one will tell you this is a good idea. So prep yourself for the nay sayers. 

To be clear I have not taken any loans to purchase BTC. I totally would if the right dip happened. All my stacking has been from hard work mining fiat. ",239,0.93,108,https://reddit.com/r/Bitcoin/comments/1msy1ay/not_paying_down_debt_instead_adding_btc/,https://www.reddit.com/r/Bitcoin/comments/1msy1ay/not_paying_down_debt_instead_adding_btc/,False,False,False,False,
cryptomarkets,1msy166,1755454099.0,2025-08-17T18:08:19+00:00,jordanlndn,What do you think of my portfolio?,"What do you all think of my current portfolio?

- Link (27.4%) - put in £275
- Btc (23.1%) - put in £250
- Eth (21.9%) - put in £250
- Hbar (8.3%) - put in £100
- Kas (8.3%) - put in £100
- Tao (2.2%) - put in £25
- Sui (2.2%) - put in £25
- Fet (2.2%) - put in £25
- Aioz (2.2%) - put in £25
- Pengu (2.2%) - put in £25


I plan on putting more money into crypto over the next few weeks by DCA, but am considering what to put it towards. Do I go more heavy into one of my current coins, or is there anything else worth researching?
",0,0.4,10,https://reddit.com/r/CryptoMarkets/comments/1msy166/what_do_you_think_of_my_portfolio/,https://www.reddit.com/r/CryptoMarkets/comments/1msy166/what_do_you_think_of_my_portfolio/,False,False,False,False,Discussion
CryptoCurrency,1msxyqu,1755453940.0,2025-08-17T18:05:40+00:00,kronosbit,Subscriptions on Blockchain,"What is the best way do to automatically recurring payments for groups/services? I'm wondering can the blockchain solve this somehow? 

For what I have seen there is actually no automatic subscription possible, and you just need to renew montly manually with a new transaction. The alternative would be to increase a lot the spending cap or having sidewallets with infinite spending.

Imagine having to renew all the subscriptions manually every month, would be insane. A decent solution is Coinbase pay but slow/limited and last time I used it you had to have your money on CEX but that defies the purpose.

I've been in crypto for some years but not very techsavy. Simple one I found was SUBY which has a bot which reminds your subscribers through discord/telegram. Another one used is helio but that idk, seems too mechanic and UI isnt that great.

Is it really that hard as a problem to solve? Eager to know your opinions",0,0.5,5,https://reddit.com/r/CryptoCurrency/comments/1msxyqu/subscriptions_on_blockchain/,https://www.reddit.com/r/CryptoCurrency/comments/1msxyqu/subscriptions_on_blockchain/,False,False,False,False,DISCUSSION
CryptoCurrency,1msxu3c,1755453652.0,2025-08-17T18:00:52+00:00,KIG45,"Could Bitcoin Really Hit $280,000 in 2025? This Legendary Trader Thinks So",,0,0.37,18,https://reddit.com/r/CryptoCurrency/comments/1msxu3c/could_bitcoin_really_hit_280000_in_2025_this/,https://www.benzinga.com/crypto/cryptocurrency/25/08/47174876/could-bitcoin-really-hit-280000-in-2025-this-legendary-trader-thinks-so?utm_source=coingecko&amp;utm_campaign=partner_feed&amp;utm_medium=partner_feed&amp;utm_content=site,False,False,False,False,GENERAL-NEWS
Bitcoin,1msxo3f,1755453279.0,2025-08-17T17:54:39+00:00,IncreaseCareless123,Anyone rocking 50/50 ETF/BTC split?,"TLDR: If you split investments between ETF and BTC, which ETF?

I have an impression that VOO & Chill strategy is good when you either start early 20s, or when you have sustainable money to invest right away. 

I am finishing with the emergency fund and looking to start with investments. I have about 1500 pet month to invest. I am seriously considering 50/50 split between QQQM and BTC. 

I don’t believe BTC will ever replace fiat, but I do believe in a new type of asset in a form of a digital gold. I’ve been watching BTC since 2017, but never got extra money to put in. I don’t want to watch it another 8 years and missing out again. 

I know people in this sub are often going with 100 BTC, but this is too much for me. My logic in 50/50 is that if BTC continues to grow, I’ll be in a good shape in 5-10 years. If government screw it (regulations, taxes, idk) I’ll have 50% in top 100 US companies. If both BTC and top 100 will fail, well I’ll be poor, but I’ll be one of many. 

Small % and a company match will go in 401k VOO alternative. I don’t count that part for simplicity. 

Thoughts?",3,0.55,31,https://reddit.com/r/Bitcoin/comments/1msxo3f/anyone_rocking_5050_etfbtc_split/,https://www.reddit.com/r/Bitcoin/comments/1msxo3f/anyone_rocking_5050_etfbtc_split/,False,False,False,False,
CryptoCurrency,1msxcm4,1755452574.0,2025-08-17T17:42:54+00:00,diwalost,Thailand Launches Tourist Crypto Wallet to Spend Crypto in Baht,,71,0.95,12,https://reddit.com/r/CryptoCurrency/comments/1msxcm4/thailand_launches_tourist_crypto_wallet_to_spend/,https://en.cryptonomist.ch/2025/08/17/thailand-launches-tourist-crypto-wallet-to-spend-crypto-in-baht/,False,False,False,False,GENERAL-NEWS
cryptomarkets,1msx5jw,1755452130.0,2025-08-17T17:35:30+00:00,Used_Faithlessness66,Best casino altcoin,"If you had to put 450$ on red or black (an highly volatile altcoin) for this altseason, what would it be and why ?

Was thinking ADA...",6,0.88,9,https://reddit.com/r/CryptoMarkets/comments/1msx5jw/best_casino_altcoin/,https://www.reddit.com/r/CryptoMarkets/comments/1msx5jw/best_casino_altcoin/,False,False,False,False,
CryptoCurrency,1msx5jb,1755452129.0,2025-08-17T17:35:29+00:00,Every_Hunt_160,Bitcoin risks new 2025 correction as BTC price uptrend starts 7th week,,5,0.6,4,https://reddit.com/r/CryptoCurrency/comments/1msx5jb/bitcoin_risks_new_2025_correction_as_btc_price/,https://cointelegraph.com/news/bitcoin-risks-2025-correction-btc-price-uptrend-starts-7th-week,False,False,False,False,🔴 UNRELIABLE SOURCE
ethtrader,1mswgja,1755450530.0,2025-08-17T17:08:50+00:00,CryptopolitanNews,Behind Ethereum’s pullback: Institutions keep buying while retail panics,"Classic smart money vs retail situation,  
What do you think?",133,0.95,40,https://reddit.com/r/ethtrader/comments/1mswgja/behind_ethereums_pullback_institutions_keep/,https://www.cryptopolitan.com/ethereums-institutions-buying-retail-panics/,False,False,False,False,Link
Bitcoin,1mswbp9,1755450221.0,2025-08-17T17:03:41+00:00,Obvireal,Bitcoin is Financial Darwinism.,I like that. Might be biased. ,51,0.91,5,https://reddit.com/r/Bitcoin/comments/1mswbp9/bitcoin_is_financial_darwinism/,https://www.reddit.com/r/Bitcoin/comments/1mswbp9/bitcoin_is_financial_darwinism/,False,False,False,False,
cryptomarkets,1msw298,1755449625.0,2025-08-17T16:53:45+00:00,Plus-Secretary-1124,Crypto baddie advice,"Heyyy, id like to understand crypto fully, but i feel like the best way to learn is real advice from others. 

I invest a lil but honestly have no idea what im doing. Id like to become a successful crypto princess, so any and all advice would be much appreciated. Thank you! ",3,1.0,7,https://reddit.com/r/CryptoMarkets/comments/1msw298/crypto_baddie_advice/,https://www.reddit.com/r/CryptoMarkets/comments/1msw298/crypto_baddie_advice/,False,False,False,False,Support-Open
cryptomarkets,1msvnp9,1755448672.0,2025-08-17T16:37:52+00:00,idtfgarcia,Been hodling forever… finally ready to try DeFi. How are you actually making money with it?,"I’ve been hodling for a while but now I’m ready to risk a tiny part of my stack to finally learn DeFi instead of just watching from the sidelines.

So I gotta ask — how are you guys actually making money with DeFi right now? Yield farming? LPs? Playing around with stablecoin strategies?

If you’ve got any tips, mistakes to avoid, or resources that helped you get started, drop them below. Also curious — what’s been your best/worst DeFi play so far?

Appreciate any wisdom 🙏",9,0.91,9,https://reddit.com/r/CryptoMarkets/comments/1msvnp9/been_hodling_forever_finally_ready_to_try_defi/,https://www.reddit.com/r/CryptoMarkets/comments/1msvnp9/been_hodling_forever_finally_ready_to_try_defi/,False,False,False,False,Discussion
Bitcoin,1msvn7c,1755448639.0,2025-08-17T16:37:19+00:00,Qndra8,"Price, statistical widgets and converter.","Hi there,

I’ve put together a few BTC widgets and a converter. Originally, I made them just for myself, but maybe they’ll be useful for someone else too.

The converter lets you switch between BTC or Satoshi and a wide range of fiat currencies, both ways.  
The widgets show the price of 1 BTC, or how many satoshis you need for 1 doll/euro/gbp etc.r (there’s also a slim version that takes up almost no space). The extended version even shows some BTC blockchain statistics.  
And for all of them, you can play around with the colors — both background and text.

You can find them on the Play Store: [https://play.google.com/store/apps/developer?id=OndraN](https://play.google.com/store/apps/developer?id=OndraN)



EDIT: Just to get ahead of it before anyone says this might be a scam, hacking attempt, or something shady… The app does **not** collect any user data and doesn’t have access to anything, this is also declared in the app manifest. If anyone still has doubts, please feel free to report it directly on the Play Store. You don’t even need to download it to do that.",9,0.91,5,https://reddit.com/r/Bitcoin/comments/1msvn7c/price_statistical_widgets_and_converter/,https://i.redd.it/b2ppptanuljf1.png,False,False,False,False,
CryptoCurrency,1msvgpr,1755448217.0,2025-08-17T16:30:17+00:00,Realistic_Poetry5800,94 Percent XRP Holders in Profit as Price Surpasses $3 Rally,,81,0.83,20,https://reddit.com/r/CryptoCurrency/comments/1msvgpr/94_percent_xrp_holders_in_profit_as_price/,https://www.ainvest.com/news/xrp-news-today-94-percent-xrp-holders-profit-price-surpasses-3-rally-2508/,False,False,False,False,GENERAL-NEWS
Bitcoin,1msv3fy,1755447361.0,2025-08-17T16:16:01+00:00,SpiritualPatience728,Anyone born on 3rd Jan 2009,Just wondering anyone who’s born on 3 jan 2009 is a bitcoiner here?? Or anyone in your family born on 3rd jan 2009 is into bitcoin,0,0.35,9,https://reddit.com/r/Bitcoin/comments/1msv3fy/anyone_born_on_3rd_jan_2009/,https://www.reddit.com/r/Bitcoin/comments/1msv3fy/anyone_born_on_3rd_jan_2009/,False,False,False,False,
cryptomarkets,1msuwd6,1755446906.0,2025-08-17T16:08:26+00:00,bearlyhuman4697,XRP vs. MC and VISA,,0,0.5,0,https://reddit.com/r/CryptoMarkets/comments/1msuwd6/xrp_vs_mc_and_visa/,/r/XRP/comments/1mssvwx/xrp_vs_mc_and_visa/,False,False,False,False,STRATEGY
cryptomarkets,1msut9m,1755446707.0,2025-08-17T16:05:07+00:00,bynarie,Where to buy ETH?,Where do you guys recommend buying ETH from that can be immediately moved to self custody? I do not want to wait 7 days or whatever. And coinbase is not an option for me. Is there an ETH only market?,10,0.86,12,https://reddit.com/r/CryptoMarkets/comments/1msut9m/where_to_buy_eth/,https://www.reddit.com/r/CryptoMarkets/comments/1msut9m/where_to_buy_eth/,False,False,False,False,Support-Open
cryptomarkets,1msurxb,1755446617.0,2025-08-17T16:03:37+00:00,Special-Caregiver530,Buying btc at ath long term,"Im a foreign investor and majority of my portfolio is us stocks.and us economy is also very concerning lately not to mention the weakening usd that affects my stocks gains..

But im not gonna touch on that

Do u all think its a good idea to start dca ing a lot more into btc or eth instead of us stocks.

Im not really looking for a crazy 2x return..js a similar return to my usual stocks portfolio would do (around 11% annually)

My english is a bit bad tho and would love to listen from more experienced opinions😄",11,0.83,19,https://reddit.com/r/CryptoMarkets/comments/1msurxb/buying_btc_at_ath_long_term/,https://www.reddit.com/r/CryptoMarkets/comments/1msurxb/buying_btc_at_ath_long_term/,False,False,False,False,
cryptomarkets,1msuc9n,1755445598.0,2025-08-17T15:46:38+00:00,Special-Caregiver530,Buying bitcoin at ath long term play,"Im a foreign investor and most of my portfolio is in usd or us stocks.Its js a bit scary to see the usd weakens drop by that much in such a small time frame but im not gonna talk about that

Im just wondering if its a good idea for like 5-10 years time frame to js adjust my portfolio and dca more into btc (or eth) rather than us markets.

What do u guys think is the long term ceiling for btc.

Im not really looking for a crazy 2x return, as long as it do similar to my stock portfolio i wouldnt mind tbh which is around (11%) annually",1,1.0,3,https://reddit.com/r/CryptoMarkets/comments/1msuc9n/buying_bitcoin_at_ath_long_term_play/,https://www.reddit.com/r/CryptoMarkets/comments/1msuc9n/buying_bitcoin_at_ath_long_term_play/,False,False,False,False,
cryptomarkets,1msu7kn,1755445295.0,2025-08-17T15:41:35+00:00,Independent-Base-239,Newbie in need of some advice,"I’ve been watching the whole memecoin madness and wondering if it’s even worth trying to start small. Like, is it actually possible to jump on Phantom with $10 and build it into something bigger, or nah?

I traded $Rizzmas back when the hype was going on, had a huge % gain at one point but held too long waiting for it to grow even bigger (greedy), and ended up fumbling it. Now I’m thinking about trying to play it smarter, maybe like some kind of small-scale “day trading” on Phantom (if that’s even realistic or possible). Basically, catching quick flips instead of hoping for the next 100x.

Do you guys think starting with $10 is viable or doable? Any strategies, tips, or warnings for someone who wants to test the waters again without wrecking themselves?

Edit: I'd appreciate any type of advice! :D",1,1.0,4,https://reddit.com/r/CryptoMarkets/comments/1msu7kn/newbie_in_need_of_some_advice/,https://www.reddit.com/r/CryptoMarkets/comments/1msu7kn/newbie_in_need_of_some_advice/,False,False,False,False,DISCUSSION
Bitcoin,1msu585,1755445142.0,2025-08-17T15:39:02+00:00,Emergency_Emu_5248,The real one,,246,0.95,11,https://reddit.com/r/Bitcoin/comments/1msu585/the_real_one/,https://i.redd.it/g9dgwmconljf1.jpeg,False,False,False,False,
CryptoCurrency,1msu341,1755445002.0,2025-08-17T15:36:42+00:00,Dongerated,"Founder Jason Zhao leaves Story Protocol after 3.5 years of doing nothing, leaving investors outraged","https://www.linkedin.com/posts/jasonjinzhao_after-35-years-building-story-from-scratch-activity-7362344084398579712-AXDQ


Story Protocol, a pioneering Layer 1 (L1) blockchain platform leveraging AI to transform intellectual property (IP) management, recently announced a significant leadership transition. Co-founder Jason Zhao is stepping back from his full-time role after 3.5 years to launch another project. This development, set against the backdrop of Story Protocol’s $134–$140 million in funding from prominent investors like Andreessen Horowitz, Endeavor, and Samsung Ventures, underscores the need for vigilance when investing in emerging L1 projects, even those backed by high-profile venture capitalists (VCs).

This case exemplifies the inherent risks associated with emerging Layer 1 blockchain projects. Leadership transitions, particularly following significant funding rounds, can generate uncertainty regarding a project’s stability and capacity to achieve its objectives. Even with support from prominent venture capital firms, success is not assured.

Such instances of maximum extractions by founders are increasingly prevalent in the industry. Investors are strongly advised to exercise caution and conduct thorough due diligence before committing to new projects.",50,0.84,28,https://reddit.com/r/CryptoCurrency/comments/1msu341/founder_jason_zhao_leaves_story_protocol_after_35/,https://www.reddit.com/r/CryptoCurrency/comments/1msu341/founder_jason_zhao_leaves_story_protocol_after_35/,False,False,False,False,DISCUSSION
Bitcoin,1mstx1b,1755444609.0,2025-08-17T15:30:09+00:00,Hazys,Just curious any Online browser games can earn BTC?,"I know this don't earn much, I just wanna pass some times play Online browser game to kill some time on the same time don't feel my time wasting on playing games yet can earn some BTC.

I not preferring those games need to be download. i mean can play via from the website and earn some BTC.",0,0.33,14,https://reddit.com/r/Bitcoin/comments/1mstx1b/just_curious_any_online_browser_games_can_earn_btc/,https://www.reddit.com/r/Bitcoin/comments/1mstx1b/just_curious_any_online_browser_games_can_earn_btc/,False,False,False,False,
Bitcoin,1mstw24,1755444544.0,2025-08-17T15:29:04+00:00,Fiach_Dubh,Happy 8th Birthday to BTCPay Server. Go rewatch the documentary on this rebellious open source Bitcoin project: My Trust in You is Broken,"Great documentary and great team working on this open source bitcoin project. Happy Birthday!

[https://www.youtube.com/watch?v=Z78ZbPcsc3g](https://www.youtube.com/watch?v=Z78ZbPcsc3g)

For more history on this time period in Bitcoin, go read the Block Size Wars.",28,0.97,2,https://reddit.com/r/Bitcoin/comments/1mstw24/happy_8th_birthday_to_btcpay_server_go_rewatch/,https://x.com/8ITCOlN/status/1957101791423725815,False,False,False,False,
cryptomarkets,1mstvap,1755444494.0,2025-08-17T15:28:14+00:00,comopollotodoslosdia,Is it worth buying xrp? Or should I play it safe and buy eth?,Obviously they would be other types of securities that I would be willing to invest in. I think that in eth 1000 usd and in xrp it would be 200/300,18,0.65,99,https://reddit.com/r/CryptoMarkets/comments/1mstvap/is_it_worth_buying_xrp_or_should_i_play_it_safe/,https://www.reddit.com/r/CryptoMarkets/comments/1mstvap/is_it_worth_buying_xrp_or_should_i_play_it_safe/,False,False,False,False,Discussion
cryptomarkets,1mstuta,1755444462.0,2025-08-17T15:27:42+00:00,Narrow_Chance7639,Beyond Charts: How Do You Track Market Narratives in Real Time?,"Hey everyone,
My small team and I have been wrestling with a problem for a while now, and I'm genuinely curious to hear this community's thoughts.
It feels like 90% of our tools are focused on purely quantitative data (price, volume, indicators), but anyone who has been in the markets long enough knows that the real driver is often the story, or the narrative, that captures people's imagination.
We see the aftermath on the charts, but the cause—the initial capital flows, the shift in social sentiment, the moment a story starts to gain real traction—is incredibly hard to see in real time. We're always a step behind.
To try and solve this for ourselves, we've been building a tool called tradesuss. It's a simulation that attempts to analyze on-chain data and social chatter to better understand and track these market narratives.
We're getting ready to let the first group of testers in to see what we've built and help us shape it. Sign-ups for the private preview are going live tomorrow .


My question for you all is: How do you currently track narratives? What are the key signals you look for manually that you wish could be automated?
Genuinely looking for insights from other serious traders/builders here. Thanks.",0,0.5,1,https://reddit.com/r/CryptoMarkets/comments/1mstuta/beyond_charts_how_do_you_track_market_narratives/,https://www.reddit.com/r/CryptoMarkets/comments/1mstuta/beyond_charts_how_do_you_track_market_narratives/,False,False,False,False,Support-Open
CryptoCurrency,1mstm64,1755443893.0,2025-08-17T15:18:13+00:00,Calm_Voice_9791,"Altcoins, Stablecoins, Tokenized Stocks Drive July’s Crypto Gains, Binance Says",,6,0.8,3,https://reddit.com/r/CryptoCurrency/comments/1mstm64/altcoins_stablecoins_tokenized_stocks_drive_julys/,https://www.coindesk.com/markets/2025/08/16/altcoins-stablecoins-tokenized-stocks-drive-july-s-crypto-gains-binance-says,False,False,False,False,🟢 GENERAL-NEWS
Bitcoin,1mstl5o,1755443828.0,2025-08-17T15:17:08+00:00,matheuslat,Bitcoin is a tool. Not the goal. The goal is freedom,"For you, whats more important: the price of Bitcoin or the freedom it brings?",152,0.96,5,https://reddit.com/r/Bitcoin/comments/1mstl5o/bitcoin_is_a_tool_not_the_goal_the_goal_is_freedom/,https://i.redd.it/b39jh8qrjljf1.png,False,False,False,False,
CryptoCurrency,1mstdji,1755443331.0,2025-08-17T15:08:51+00:00,Next_Statement6145,"Google searches for ""crypto"" reach a yearly ATH",,553,0.93,58,https://reddit.com/r/CryptoCurrency/comments/1mstdji/google_searches_for_crypto_reach_a_yearly_ath/,https://www.reddit.com/gallery/1mstdji,False,False,False,False,GENERAL-NEWS
CryptoCurrency,1mstcdb,1755443256.0,2025-08-17T15:07:36+00:00,No-Elephant-Dies,"Crypto influencer Charles Parks III, also known as CP30, has been jailed for cryptojacking scheme",,8,0.75,3,https://reddit.com/r/CryptoCurrency/comments/1mstcdb/crypto_influencer_charles_parks_iii_also_known_as/,https://www.justice.gov/usao-edny/pr/crypto-influencer-sentenced-prison-multi-million-dollar-cryptojacking-scheme,False,False,False,False,🟢 REGULATIONS
ethtrader,1mst5qm,1755442827.0,2025-08-17T15:00:27+00:00,kirtash93,"Sir, We Found Him",,22,0.8,36,https://reddit.com/r/ethtrader/comments/1mst5qm/sir_we_found_him/,https://i.redd.it/480ydthqgljf1.png,False,False,False,False,Meme
Bitcoin,1mssktu,1755441442.0,2025-08-17T14:37:22+00:00,Icy-Landscape-5819,Best time to invest a sizeable chunk of money in Bitcoin,"I want to put quite a bit of money into bitcoin but I’m not sure when the best timing would be. I don’t want to buy near the top of the market and be holding bags for a couple of years. 
Will there be a cooling off from the current cycle and when is that likely to occur? 

I realise this is an arbitrary question and it could always keep going up from here but I’m interested in peoples opinions. 

Thanks ",2,0.55,46,https://reddit.com/r/Bitcoin/comments/1mssktu/best_time_to_invest_a_sizeable_chunk_of_money_in/,https://www.reddit.com/r/Bitcoin/comments/1mssktu/best_time_to_invest_a_sizeable_chunk_of_money_in/,False,False,False,False,
Bitcoin,1mss39l,1755440255.0,2025-08-17T14:17:35+00:00,MRLONGISLAND86,My wife is GREAT!,"Today is my 39th Bday! Wife got me a cake... 

Tell me your wife supports the vision, without telling me she supports the vision! LOL",772,0.98,25,https://reddit.com/r/Bitcoin/comments/1mss39l/my_wife_is_great/,https://i.redd.it/u8kaq6a59ljf1.jpeg,False,False,False,False,
CryptoCurrency,1msrtvf,1755439603.0,2025-08-17T14:06:43+00:00,nitelight7,"XRP and XLM Surge as Ripple, Stellar Join DTCC's $2.5 Quadrillion Network","[link](https://thetradable.com/crypto/xrp-and-xlm-surge-as-ripple-stellar-join-dtccs-25-quadrillion-network-ig--m)

Ripple’s XRP and Stellar’s XLM have been connected to the Depository Trust & Clearing Corporation (DTCC) network through its Securrency acquisition. 

The DTCC processes about $2.5 quadrillion in securities annually, so this move links the two tokens directly with major traditional finance infrastructure. 

The news positions XRP and XLM as more than speculative assets, highlighting their potential role in institutional settlement systems. 

Market reaction has been positive: XRP is trading near $3 and XLM, despite a slight daily dip, has gained strongly over the past month and quarter.
",0,0.26,6,https://reddit.com/r/CryptoCurrency/comments/1msrtvf/xrp_and_xlm_surge_as_ripple_stellar_join_dtccs_25/,https://www.reddit.com/r/CryptoCurrency/comments/1msrtvf/xrp_and_xlm_surge_as_ripple_stellar_join_dtccs_25/,False,False,False,False,DISCUSSION
CryptoCurrency,1msrt0n,1755439541.0,2025-08-17T14:05:41+00:00,CriticalCobraz,Winklevoss twins’ crypto company Gemini files for IPO,"Gemini Space Station Inc., a crypto exchange and custodian bank founded by the Winklevoss twins, has filed for an initial public offering (IPO) on the Nasdaq Global Select Market under the symbol GEMI.   
  
The company reported widening net losses, with a net loss of $158.5 million on $142.2 million in revenue in 2024, and a net loss of $282.5 million on $67.9 million in revenue in the first six months of 2025. This is the latest crypto company to go public, following Circle Internet Group and Bullish, which have also raised significant funds through their IPOs.

",70,0.92,16,https://reddit.com/r/CryptoCurrency/comments/1msrt0n/winklevoss_twins_crypto_company_gemini_files_for/,https://finance.yahoo.com/news/winklevoss-twins-crypto-company-gemini-001643100.html,False,False,False,False,GENERAL-NEWS
